Url,Identifier,PrefLabel,Definition,Version,Deprecated,Date
http://vocab.nerc.ac.uk/collection/L22/current/TOOL0612/,SDN:L22::TOOL0612,Institute of Oceanographic Sciences shipborne wave recorder,"A vessel-mounted wave recorder comprising a pair of heave transducers (accelerometers), a pair of pressure transducers, a signal processing unit and a data recorder. One heave transducer (measures long-period waves) and one pressure transducer (measures short-period waves) are mounted together on each side of the vessel close to the centre of pitch and 1-3m below the water-line to reduce the influence of pitch and roll. Waves of up to 30m height and 25 seconds period can be measured; the lower detectable limit depends on the installation depth of the pressure units. More information may be found in http://www.bodc.ac.uk/data/documents/nodb/45603/.",1,false,2013-04-11 16:07:16.0
http://vocab.nerc.ac.uk/collection/L22/current/TOOL1325/,SDN:L22::TOOL1325,National Oceanography Centre Spar Buoy [modified length] {Bubble Buoy} capacitance wave wire buoy,"A custom-built system that uses capacitance wave wires mounted on a spar buoy to measure waves, wave breaking and whitecaps in-situ. This is a modified version of the standard National Oceanography Centre Spar Buoy that uses a slightly longer and stronger buoy in order to mount acoustic resonators to measure sub-surface bubble populations.",1,false,2019-03-15 15:19:00.0
http://vocab.nerc.ac.uk/collection/L22/current/TOOL1093/,SDN:L22::TOOL1093,MIROS SM-050 Wave and Current Radar Mk III,"A wave and surface current radar designed for the measurement of directional wave spectra and surface currents. The sensor was developed for stationary floating units such as drill ships and floating production storage and offloading units, but could be used in transits at speeds up to 6-8 knots (11-14 km per hour). Moreover, the radar's frequencies were chosen to obtain a strong echo from the capillary waves (normally present at wind speed above 2 metres per second) but reaches its best working performance at a wind speed of 3 metres per second or above. The instrument uses a dual footprint pulse Doppler method for wave measurements, and a  microwave dual frequency method for measuring surface current. The radar observes the ocean surface in a semi-circle using 6 sectors of 30 degrees, scanning the surface in sequence. The system consists of the radar, the junction box, the indoor interface unit, the desktop system computer and the wave radar software. The instrument operates effectively between temperatures of -15 to 30 degrees celsius. The MIROS SM-050 has an accuracy of 5 percent for wave height and period, and and accuracy of 7 degrees for wave and current directions. The instrument also has an accuracy ranging from -0.05 to +0.05 metres per second for current speed.",1,false,2016-11-25 10:48:51.0
http://vocab.nerc.ac.uk/collection/L22/current/TOOL0157/,SDN:L22::TOOL0157,Interocean S4DW current meter directional wave monitor,"Instrument combines electromagnetic current sensors and a high precision pressure sensor to measure wave orbital current components,directional wave spectra and tides. Incorporates programmable burst mode sampling and a very high capacity data logger.",1,false,2010-05-18 16:10:58.0
http://vocab.nerc.ac.uk/collection/L22/current/TOOL0928/,SDN:L22::TOOL0928,Delta-T Instruments PAR sensor,"Instrument used to measure the photosynthetically active radiation spectral range of solar radiation. The model is unknown. It is assumed to have a spectral response of 400-700nm. It could have any type of collector (flat plate cosine collector, spherical or hemispherical).",1,false,2015-07-30 14:44:53.0
http://vocab.nerc.ac.uk/collection/L22/current/TOOL1241/,SDN:L22::TOOL1241,Nortek Signature55 Acoustic Doppler Current Profiler,"An Acoustic Doppler Current Profiler (ADCP) for use in in ocean circulation, turbulence, numerical model verification and transport studies. The instrument consists of three piezo-composite transducers which are 25 cm in diameter. The beams operate at long-range (1000 m) and in dual-frequency (55 / 75 kHz) modes. The instrument contains integrated pressure and temperature sensors measuring in the range of  0-1500m (pressure) and -4 - 40 degC (temperature). Data communication is available via Ethernet cable and the instrument has an internal storage capacity of 16 Gb, with an option to increase this to 64 Gb.",1,false,2018-06-04 14:45:48.0
http://vocab.nerc.ac.uk/collection/L22/current/TOOL1267/,SDN:L22::TOOL1267,Sensoren Instrumente Systeme Digital Reversing Pressure Meter,"First generation of digital reversing pressure meters manufactured by Sensoren Instrumente Systeme (SiS). These include instruments P6132H and P6394H, which were fitted on the CTD frame during some cruises from the 1990s.",1,false,2018-08-02 15:26:57.0
http://vocab.nerc.ac.uk/collection/L22/current/TOOL0445/,SDN:L22::TOOL0445,Teledyne RDI Broadband 150kHz ADCP,The RDI Broadband ADCP is designed for mooring deployment and has an operating frequency of 150 kHz. The instrument uses Doppler-technology to achieve accurate and non-intrusive measurements and it can come with pressure and temperature sensors. It can be used in real time measurement situations or can log to an internal recorder powered by internal batteries.,1,false,2011-11-24 11:44:57.0
http://vocab.nerc.ac.uk/collection/L22/current/NETT0175/,SDN:L22::NETT0175,Lindahl dividable phytoplankton sampling hose,A rubber hose (material may vary) comprising length sections which integrate water samples from selected depth intervals. The division of the hose is adapted as needed. The hose inner diameter is >12 mm. The hose end is weighted. The hose is slowly lowered into the water (20 m/min). The top valve is closed when the hose has reached maximum depth. Sections are sequentially closed with valves as they appear during ascent. A full description is available in https://www.bodc.ac.uk/data/documents/nodb/pdf/Lindahl_1986.pdf.,1,false,2014-09-12 17:20:07.0
http://vocab.nerc.ac.uk/collection/L22/current/TOOL0288/,SDN:L22::TOOL0288,Biospherical QCP-2300 underwater PAR sensor,Log output quantum cosine PAR profiling sensor. For use with 12 bit ADC systems. Single channel analog output voltage is proportional to the log of incident PAR (Photosynthetically Available Radiation: 400-700 nm) irradiance. Cosine corrected for use underwater to depths up to 1000 m.,1,false,2010-05-18 16:10:58.0
http://vocab.nerc.ac.uk/collection/L22/current/TOOL0562/,SDN:L22::TOOL0562,IFM Kiel clean pumped sea water supply,"A system designed for continuous, underway, clean sampling of near-surface waters. A hollow stainless steel shaft holding a high density polyethylene (HDPE) tube is submerged beneath a vessel through a hole in the hull. The inlet head is located 1.7 m below the keel and features a sieve-like Teflon cap. Water is pumped from the inlet through a serial ball-valve panel from which it can be directed to different sampling facilities. Flow is maintained by chemically inert double membrane pump driven by compressed air. HDPE tubing is used throughout the system and the valves are composed of polypropylene and Teflon, thereby ensuring that the sampled water remains clean and suitable for trace metal analyses. The system was developed by what was then the Institut fur Meereskunde at Kiel University.",1,false,2012-10-15 14:57:16.0
http://vocab.nerc.ac.uk/collection/L22/current/TOOL1118/,SDN:L22::TOOL1118,Agilent 5973Network Mass Selective Detector,"A mass selective detector (MSD) designed to be used with the 6890 Plus Series Gas Chromatograph. This transmission quadrupole mass spectrometer is used for qualitative and quantitative analysis by electron ionization (EI), positive chemical ionization (PCI), and negative chemical ionization (NCI). The system comes in five different models: G2577A (diffusion pump EI MSD), G2578A (standard turbo EI MSD), G2579A (Performance turbo EI MSD), G2588A (standard turbo EI/PCI MSD), and G2589A (performance turbo EI/PCI/NCI MSD).",1,false,2017-03-08 14:06:54.0
http://vocab.nerc.ac.uk/collection/L22/current/NETT0026/,SDN:L22::NETT0026,"Continuous Plankton Recorder - Hardy (1926, 1936); Glover (1962)","Construction is a 1.27 cm on side square mouth opening (originally 10.1 cm diameter) high-speed (12 to 17 knots) towed body collecting plankton on gauze (22.9 cm wide and 23.6 meshes per cm) rolls. The body is 50 cm wide x 50 cm tall x 100 cm long.  A propellor drives the rollers winding up the gauze.  The system is normally towed at 10 m depth at speeds up to 20 ktnos [Wiebe and Benfield 2003 Plate 19 A, B].",1,false,2011-10-21 14:18:49.0
http://vocab.nerc.ac.uk/collection/L22/current/TOOL1405/,SDN:L22::TOOL1405,Unknown manual bilge pump,A hand-powered submersible pump that can be used to suck water from the water body for sampling as well as other applications.,1,false,2020-02-14 10:24:24.0
http://vocab.nerc.ac.uk/collection/L22/current/TOOL1321/,SDN:L22::TOOL1321,SubCtech OceanPack RACE 5th generation {FerryBox} combined pCO2 analyser and underway system,"A flow-through system packaged into a mobile manifold that is used for underway pC02 monitoring on sailing yachts. As standard, each unit is fitted with a dedicated LI-COR LI-840x pCO2 analyser that measures CO2 and H2O using a silicone flat membrane equilibrator and non-dispersive infrared detection (dual wavelength). The analyser is capable of auto-zeroing and automatic compensation of water vapour (H2O), pressure and temperature. The overall unit features a data logger, de-bubbler and water supply. It is capable of integrating auxiliary sensors (e.g. SST, SSS, D.O., algae). In addition, external devices can be included such as nutrient analysers, micro-plastics analysers, meteorological stations, GPS and Air-CO2 analysers. Data are internally stored and transmitted. Optional features include automatic cleaning and auto-calibration. Overall accuracy of the pCO2 analyser is < 1% with a resolution of 0.01 ppm CO2 and 0.001 ppt H2O.",1,false,2019-02-22 10:39:08.0
http://vocab.nerc.ac.uk/collection/L22/current/TOOL1135/,SDN:L22::TOOL1135,Kompressoren-Pumpen-Zentrale GMBH pump,A submersible pump that can be used for multiple applications where large volumes of water are required.,1,false,2017-06-14 16:49:46.0
http://vocab.nerc.ac.uk/collection/L22/current/TOOL0413/,SDN:L22::TOOL0413,Non-toxic sea water supply,A source of uncontaminated near-surface (commonly 3 to 7 m) seawater pumped continuously to shipboard laboratories on research vessels. There is typically a temperature sensor near the intake (known as the hull temperature) to provide measurements that are as close as possible to the ambient water temperature. The flow from the supply is typically directed through continuously logged sensors such as a thermosalinograph and a fluorometer. Water samples are often collected from the non-toxic supply. The system is also referred to as the underway supply.,1,false,2011-08-05 09:08:32.0
http://vocab.nerc.ac.uk/collection/L22/current/TOOL0420/,SDN:L22::TOOL0420,Pall AcroPak 200 filter cartridge,"A filter cartridge designed for small- to medium-volume sterile filtration. It incorporates a Supor [hydrophilic polyethersulfone (PES)] membrane, which allows high flow rates and throughputs (up to 20 litres), and is ideal for solutions where low protein binding is required. Pore sizes range from 0.2 to 0.8 um and the effective filtration area is 200 cm^2. A built-in prefilter extends filter life when particulate-laden solutions, such as serum-containing media, are processed. The filter is manufactured without the use of adhesives to minimize extractables, sterilized by gamma irradiation and individually packaged.",1,false,2011-09-03 16:28:15.0
http://vocab.nerc.ac.uk/collection/L22/current/TOOL0500/,SDN:L22::TOOL0500,Stand-alone pump,A submersible battery powered water pump that sucks water through various filters leaving the materials of interest on the filter for analysis. SAPs are deployed clamped to a hydrographic wire and may be used to sample at depths of up to 6000 m. A SAP can pump thousands of litres of water over a few hours.,1,false,2012-06-21 16:09:48.0
http://vocab.nerc.ac.uk/collection/L22/current/TOOL0139/,SDN:L22::TOOL0139,Sunburst Submersible Autonomous Moored Instrument Carbon Dioxide Sensor,A reagent based CO2 sensor for measuring partial pressure of carbon dioxide (pCO2) in-situ in water over a range of approximately 0-2000 micro-atmospheres with a precision of approximately 1 microatmosphere at 360 microatmospheres. Maximum deployment depth is approximately 100 metres for SAMI-CO2-100 (PVC housing) and 1500 metres for SAMI-CO2-1500 (aluminium housing).,1,false,2010-05-18 16:10:58.0
http://vocab.nerc.ac.uk/collection/L22/current/NETT0143/,SDN:L22::NETT0143,Plummet net - Hovekamp ; Daly [personal communication to Wiebe and Benfield],"Construction has a 100 cm diameter mouth with a lead weighted net ring and net with 0.571 mm mesh. For downward collecting, the net was lowered by the cod-end to a pre-determined depth and a messenger used to release the cod-end attachment and draw tight a choke collar near the mouth of the net [Wiebe and Benfield 2003 Plate 9 D].",1,false,2011-10-21 14:18:49.0
http://vocab.nerc.ac.uk/collection/L22/current/NETT0169/,SDN:L22::NETT0169,ORI-33 - Omori (1965),Has a 160 cm diameter mouth opening with 2x70 cm long cylinder sections plus 2 conical sections 450 cm. All GG 54 silk netting. Equipped for a Motoda double releasing mechanism.,1,false,2011-10-21 14:18:49.0
http://vocab.nerc.ac.uk/collection/L22/current/TOOL0739/,SDN:L22::TOOL0739,Sea-Bird SBE 63 dissolved oxygen sensor,An optode dissolved oxygen sensor mounted in plastic (600m operating depth) or titanium (7000m operating depth) housing that interfaces through an RS-232 connection to SeaCAT  or MicroCAT CTDs or Navis Argo float. Accuracy is the greater of 3 micromole/kg or 2%. More information is available at http://www.seabird.com/products/spec_sheets/63data.htm.,1,false,2014-07-17 11:53:39.0
http://vocab.nerc.ac.uk/collection/L22/current/TOOL1078/,SDN:L22::TOOL1078,GEOSat Follow-On Radar Altimeter,"A radio-occultation radar altimeter designed for ocean topography, significant wave height, and sea surface wind speed observations. A digital chirp generator produces a pulse, which is up-converted in a frequency multiplier, amplified by a power amplifier and routed to the antenna by a T/R switch; the same switch directs the return signal to the receiver, which transforms range separation into frequency separation to allow sampling using Fourier Transform techniques. The receiver carries out automatic gain control (AGC) and down-converts the return signal. GFO-RA performs continuous sampling along the sub-track (nadir-only viewing), and it is supported by a microwave radiometer (MWR) for atmospheric correction. Radar cross section and height are calibrated on board. The instrument only detects at Ku-band frequency centred at 13.5 GHz. The resolution is 25 km at sub-satellite point. The pulse-limited footprint is 2 km along the sub-track. Flown on GFO. http://www.wmo-sat.info/oscar/instruments/view/154",1,false,2016-11-15 15:28:05.0
http://vocab.nerc.ac.uk/collection/L22/current/TOOL1352/,SDN:L22::TOOL1352,Nanometrics Titan Strong Motion Accelerograph,"A strong motion accelerograph designed for high precision observational and structural engineering applications, such as monitoring the response of a structure to ground acceleration (e.g. earthquakes). It features the same triaxial sensor as the Titan Accelerometer, but features an integrated digitiser and recorder to facilitate both standalone networked and free-field monitoring deployments. It offers GNSS, PTP or NTP timing, HTTP data communications, and data retrieval via SD card or local ethernet in MiniSEED or ASCII formats. It can detect P-wave events and broadcast warnings. It has a latency of 0.25 seconds, an operational frequency bandwidth from DC to 430 Hz, with 166 dB dynamic range. It has a full-scale range of +/- 0.25 g to +/- 4 g with independent horizontal and vertical range selection.",2,false,2019-08-09 15:57:45.0
http://vocab.nerc.ac.uk/collection/L22/current/TOOL1378/,SDN:L22::TOOL1378,Unspecified scallop dredge,"Rigid structures with a chain mail collecting bag, towed on the seabed to target king scallops. Generally used by towing several dredges side by side behind the vessel (source: seafish.org).",1,false,2019-12-19 09:54:55.0
http://vocab.nerc.ac.uk/collection/L22/current/TOOL0530/,SDN:L22::TOOL0530,Kipp and Zonen PSQ1 PAR Quantum Sensor,A non-submersible PAR sensor incorporating a diffuser with an excellent directional (cosine) response and a silicon photodiode detector. It can be used in field research or permanent applications. It has a spectral range of 400 to 700 nm and a sensitivity of 4 to 10 mV/umol/m^2/s.,1,false,2012-08-16 11:26:51.0
http://vocab.nerc.ac.uk/collection/L22/current/TOOL0556/,SDN:L22::TOOL0556,Glass bottle and bung water sampler,Glass bottle of unknown capacity used for manual water sampling. The bottle was sealed with a bung attached to a rope. The system was used for near-surface sampling during the Marine and Freshwater Microbial Biodiversity project for sampling in Priest Pot.,1,false,2012-09-28 14:08:54.0
http://vocab.nerc.ac.uk/collection/L22/current/TOOL0830/,SDN:L22::TOOL0830,AML Oceanographic Smart SV and P sound velocity probe,"A sound velocity probe for use in shallow water applications, multi-beam systems and can also be integrated in AUV and ROV systems. The probe directly measures sound velocity by the time-of flight of an acoustic ping. It also measures pressure using a temperature-compensated strain gauge. It has a range of 1400 m/s - 1600 m/s and an accuracy of +/-0.05 m/s. It has a pressure range up to 6000 m (accuracy +/-0.05% FS).",1,false,2015-02-19 10:36:40.0
http://vocab.nerc.ac.uk/collection/L22/current/TOOL0856/,SDN:L22::TOOL0856,RBR Concerto CTD,"Conductivity, temperature depth recorder with fluorometer and turbidity loggers. Self-contained, autonomous CTD logger that can be deployed for a period of up to 5 years with 1 minute sampling intervals. High accuracy measurements, holds measurements internally even without battery and fast sampling options for profiling. Temperature sensor calibrated to accuracy of +/- 0.002 deg C over range -5 to +35 deg C. Conductivity measured with inductive sensor with no exposed contacts. Pressure measured with piezo-resistive transducer with accuracy of 0.05% of full scale rating and achievable resolution of 0.001%.",1,false,2015-05-27 15:47:59.0
http://vocab.nerc.ac.uk/collection/L22/current/TOOL1195/,SDN:L22::TOOL1195,British Geological Survey Airgun Profiling System,"A British Geological Survey-built airgun profiling system composed of: a Bolt 600B gun array of five guns as sound source, each fitted with 655 cm^3 (i.e. 40 cubic inches) firing chambers; a hydrophone streamer; a compressor container; a BGS/CODA digital acquisition and processing system; and a Waverley thermal recorder.",1,false,2018-01-30 16:59:47.0
http://vocab.nerc.ac.uk/collection/L22/current/TOOL0099/,SDN:L22::TOOL0099,Ott magnetic float tide gauge,Mechanical tide gauge with a float installed in a stilling well and a magnetic encoder that converts linear movement of the wire connected to the float into a digital value.,1,false,2009-04-28 11:30:37.0
http://vocab.nerc.ac.uk/collection/L22/current/TOOL0673/,SDN:L22::TOOL0673,WETLabs ECO Puck Triplet sensor,"A miniature version of the ECO Triplet sensor. It is a three-optical-sensor, user-defined instrument that is designed for use in AUVs, gliders and profiling floats and carries any combination of single-wavelength fluorometers or scattering sensors. ECO Pucks are real?time only sensors as they are integrated onto the OEM platform that provides power and data handling. The fluorometers can be configured (with typical sensitivities) for chlorophyll (470/695 nm, sensitivity 0.015-0.025 ug/l), FDOM (370/460 nm, sensitivity 0.184 ppb), phycocyanin (630/680 nm, sensitivity 0.086 ppb), phycoerythrin (520/595 nm, sensitivity 0.086 ppb), uranine (470/530 nm, sensitivity 0.073 ppb) or rhodamine (520/595 nm, 0.086 ppb). The scattering meter can typically measure optical scattering at blue, green or red wavelengths (412, 470, 532, 650, 700 and 880 nm, sensitivity 0.002-0.003 m-1).",2,false,2019-02-11 11:24:22.0
http://vocab.nerc.ac.uk/collection/L22/current/TOOL1229/,SDN:L22::TOOL1229,Brinno TLC200 time-lapse camera,"A portable, time-lapse video and still photo camera. It is typically used in domestic applications. It outputs AVI (video) and JPG (still photo) formats with resolutions of 1280x720 or 640x480. It is 64 x 64 x 106 mm (DxWxH) in size, weighs 120 g and has up to 32 GB memory storage (SD card). It can be fitted with a wide-angle lens (0.45x) and weather resistent housing. Captures up to 270,000 frames in 2.2 days at up to 2 frames per second. Custom frame time interval: 1 sec to 24 hours. Field of view: 59 degrees. Focal length: 36 mm (35 mm equivalent). Focus distance 75 cm (minimum).",1,false,2018-04-20 17:20:46.0
http://vocab.nerc.ac.uk/collection/L22/current/TOOL0973/,SDN:L22::TOOL0973,Satlantic Photosynthetically Active Radiation sensor,"PAR (400 - 700 nm) sensor that measures quantum irradiance with near flat spectral response and cosine spatial response. Cosine collectors for in air and in water measurements for 2 depth ratings, 1000 m and 7000 m. Digital and analog output options. Compatible with SeaBird CTD platforms. Tilt and internal temperature measurements carried out for data quality analysis. Max sample rate of 100 Hz, PAR range 0 - 5000 umol photons m^-2 s^-1. Cosine error 0-60 deg <3% and 60-85 deg <10%.",1,false,2016-02-29 14:00:40.0
http://vocab.nerc.ac.uk/collection/L22/current/TOOL0380/,SDN:L22::TOOL0380,EnviroTech LLC NAS-3X Nutrient Analyser,"In-situ nutrient analyzer for high-frequency time-series determination of nutrient concentrations in marine and fresh waters. It uses a pump and valve system to acquire and react individual water samples, and versions are available for the measurement of nitrate, phosphate, silicate and ammonia. The NAS-3X replaces the NAS-2E, providing higher precision and resolution measurements. The standard depth rating is 100m, although a 250m version is also available and deeper versions may be built on request.",1,false,2011-03-14 15:22:43.0
http://vocab.nerc.ac.uk/collection/L22/current/TOOL0489/,SDN:L22::TOOL0489,Satlantic Submersible Ultraviolet Nitrate Analyser,"The Submersible Ultraviolet Nitrate Analyser (SUNA) uses ultraviolet absorption spectroscopy to measure in-situ dissolved nitrate. It is a chemical-free method that allows real-time and continuous nitrate concentration measurements in a variety of environments. It has a 1 cm path length, 190 - 370 nm wavelength range and a depth rating of 100 m.",1,false,2012-04-17 13:56:38.0
http://vocab.nerc.ac.uk/collection/L22/current/TOOL1167/,SDN:L22::TOOL1167,National Oceanography Centre (NOC) Nitrate and Nitrite v3.3c Lab-On-Chip (LOC) sensor,"A developmental microfluidic sensor that can be used in freshwater, estuarine, coastal and open ocean environment. It performs colourimetric nitrate analysis using the Griess assay on a microfluidic chip. Nitrate is reduced to nitrite using a cadmium tube. Weighing 4 kg (H = 19 cm, Dia. = 15 cm), it is housed in PVC and capable of deployments to 6000 m It uses a wavelength of 525 nm and pathlengths of 91.6, 10.16 and 1.16 mm. It has a detection limit of 25 nM and measurement range of 0.05 uM - 1000 uM.",1,false,2017-11-07 16:01:10.0
http://vocab.nerc.ac.uk/collection/L22/current/TOOL0528/,SDN:L22::TOOL0528,Satlantic ISUS V3 Nitrate Sensor,"An active optical instrument with an internal UV light source and spectrometer used to measure in-situ dissolved nitrate. It is a chemical-free method that allows real-time and continuous nitrate concentration measurements in a variety of environments. It uses a Deuterium lamp as a light source and has a 1cm path length and 200-400 nm wavelength range. It has a depth rating of 1000 m and a detection range of  0.5 to 2000 uM *(0.007 to 28 mg/l-N)  and accuracy of +/- 0.2 uM (0.028 mg/l) or ± 10% of reading, whichever is greater. The V3 has USB data transfer ability and window based software.",1,false,2012-08-09 12:59:50.0
http://vocab.nerc.ac.uk/collection/L22/current/TOOL0170/,SDN:L22::TOOL0170,EnviroTech LLC NAS-2E Nutrient Analyser,In-situ nutrient analyser for high frequency time-series determination of nutrient concentrations in marine and fresh waters.,1,false,2010-05-18 16:10:58.0
http://vocab.nerc.ac.uk/collection/L22/current/TOOL1103/,SDN:L22::TOOL1103,National Oceanography Centre (NOC) Nitrate and Nitrite v3.2c Lab-On-Chip (LOC) sensor,"A stand-alone microfluidic wet-chemical (colourimetric) nitrate and nitrite lab-on-chip (LOC) system designed to perform automated in-situ chemical analysis using the Griess assay. The instrument detects nitrate and nitrite (up to 350 µM, 21.7 mg/L as NO3-) with a limit of detection (LOD) of 0.025 µM for nitrate (0.0016 mg/L as NO3-) and 0.02 µM for nitrite (0.00092 mg/L as NO2-). This performance is suitable for all natural waters except for the oligotrophic open ocean. Beaton et al. (2012) has a full description of the technology.",3,false,2018-09-20 11:08:10.0
