Url,Identifier,PrefLabel,Definition,Version,Deprecated,Date
http://vocab.nerc.ac.uk/collection/L22/current/TOOL0292/,SDN:L22::TOOL0292,ASL Environmental Sciences IPS4 Ice Profiler Sonar,The ASL Environmental Sciences ISP4 is an upward looking sonar device for measuring ice keel drafts. Distance between the instrument and ice keel is measured by sonar at an operating frequency of 420 kHz with a beam width of 1.8 degrees and sampling rate of up to 2Hz. Water depth is measured by a pressure sensor and ice draft is calculated by difference. It has a depth range of 175 metres in ice or 225 metres in water and a precision of 0.05 metres.,2,false,2010-11-18 12:39:41.0
http://vocab.nerc.ac.uk/collection/L22/current/TOOL1250/,SDN:L22::TOOL1250,ASL Environmental Sciences Shallow Water Ice Profiler,"An upward-looking sonar device which can be mounted on lake, river or ocean floors to measure ice draft for monitoring of ice dynamics in shallow water environments. Ice thickness is measured in real-time using an acoustic transducer, tilt sensor, high-precision pressure sensor and temperature sensor, all providing suitably high resolution for shallow water measurements. The instrument can be operated in an internal recording mode with a connection to an underwater battery pack for power, or with RS-422 serial output for real-time operation using an underwater cable which also allows for external power. The SWIP has a storage capacity up to 16 Gb, an operating frequency of either 542 kHz (standard) or 235 kHz (optional), a half-beam width of 3 degrees (standard) or 5.5 degrees (optional), a sampling rate of up to 2 Hz, and a maximum range of 20 metres. The tilt sensor has a range -20 to +20 degrees, an accuracy -0.5 to +0.5 and a precision of 0.01 degrees.",1,false,2018-07-31 10:42:08.0
http://vocab.nerc.ac.uk/collection/L22/current/TOOL0844/,SDN:L22::TOOL0844,Pico-Technology PT-100 Temperature Sensor Model SE012,The platinum resistance thermometer offers a temperature range from -50 deg C to 250 deg C an accuracy of +/- 0.03 deg C at 0 deg C,1,false,2015-04-28 12:36:02.0
http://vocab.nerc.ac.uk/collection/L22/current/TOOL1183/,SDN:L22::TOOL1183,Teledyne Webb Research Slocum G1+G2 Glider Navigation data logger,"A navigation and engineering logging system located within a Slocum ocean glider (G1 and G2 models). Sensors integrated can include GPS position, pressure transducer, platform altimeter and an internal clock. In addition to sensor data, engineering and inferred data are logged such as glider inferred currents and subsurface displacements. Data are output as proprietary binary format with .sdb (real time transmitted data) or .dbd (internally logged high resolution version stored on the glider memory card) files.",1,false,2017-12-05 14:13:03.0
http://vocab.nerc.ac.uk/collection/L22/current/TOOL0061/,SDN:L22::TOOL0061,Teledyne RDI 300kHz Workhorse Monitor direct-reading ADCP,A direct reading acoustic doppler current profiler (ADCP) with a standard depth rating of 200m with a 6000m-rated case available as an option. 300kHz Broadband signal processing gives high data resolution and a four-beam solution gives an independent error velocity measurement. It operates effectively between temperatures of -5°C and 45°C and has a velocity accuracy of 0.5% of the water velocity ±0.5cm/s.,1,false,2009-11-30 11:56:35.0
http://vocab.nerc.ac.uk/collection/L22/current/TOOL1265/,SDN:L22::TOOL1265,Institute of Oceanographic Sciences 7.5 kHz profiling sonar,"A sub-bottom profiling sonar operating at 7.5 kHz, designed to detect soft sediment thickness and layering beneath the sea bed. The instrument was manufactured by the Institute of Oceanographic Sciences, Deacon Laboratory (now National Oceanography Centre, Southampton). It has a pulse length of 0.26 ms, and a penetration range of up to 70 m over soft sediment at a resolution of less than 1 m. The instrument has a transducer which operates with a conical beam pattern of 25 degrees. This instrument was fitted on TOBI, a deep-towed multi-sensor sonar system deployed in 1999 during cruise JR39b.",1,false,2018-08-02 15:26:57.0
http://vocab.nerc.ac.uk/collection/L22/current/TOOL0859/,SDN:L22::TOOL0859,Kongsberg (Simrad) TOPAS PS018 sub-bottom profiler,"TOPAS parametric sub bottom profiler is a high spatial resolution system  designed for use in depths from 10 metres to full ocean depth operation. The system is based on low frequency signal generation, high bandwidth (~80%), narrow beam profile and absent side lobes. Comprises of a transducer, transceiver unit, operator console and optional multi-channel receiver or beam former.",1,false,2015-05-27 15:47:59.0
http://vocab.nerc.ac.uk/collection/L22/current/TOOL1255/,SDN:L22::TOOL1255,Unspecified 3.5 kHz sub-bottom profiler,"A 3.5 kHz sub-bottom profiler system, designed to identify and characterise layers of sediment or rock. The system is fitted with acoustic transmitters and receivers, and operates by emitting acoustic pulses downward and detecting the reflected signals. The system can penetrate between 10 m and 50 m.",1,false,2018-08-02 15:26:57.0
http://vocab.nerc.ac.uk/collection/L22/current/NETT0008/,SDN:L22::NETT0008,"BIONESS 1m - Sameoto, Jaroszynski and Fraser (1979, 1980)","Construction is a 100 cm x 100 cm mouth opening with 10 nets.  The system is powered electrically on conducting wire and controlled from a surface deck unit. Data logging includes depth, roll, pitch, flowmeter revolutions,  temperature and conductivity.  There is also a 1/4 m system. This system has basic design similarities to that of Be MPS system [Wiebe and Benfield 2003 Plate 30 C, D].",1,false,2011-10-21 14:18:49.0
http://vocab.nerc.ac.uk/collection/L22/current/TOOL0361/,SDN:L22::TOOL0361,RS Aqua WaveRadar Rex wave and sea level sensor,Microwave radar measuring the distance between instrument and water surface. It uses a 9.7-10.3GHz linear sweep pulse to measure distances over the range 3-65 metres with an accuracy of +- 6mm for a range of less than 50 metres or +-12mm for longer ranges.,1,false,2010-11-24 09:31:30.0
http://vocab.nerc.ac.uk/collection/L22/current/TOOL0387/,SDN:L22::TOOL0387,RBR TGR-1050P submersible tide gauge,"A pressure recorder designed to measure tides. Possible ranges are 10, 20 50 and 100 dbar, with an accuracy of ± 0.05% full scale, resolution of <0.001% full scale and a time constant of <10 msec. Pressure data are sampled at 4Hz. The sample period and the length of the averaging burst are fully programmable. It has a built-in averaging function to eliminate wave action.",1,false,2011-04-08 07:51:17.0
http://vocab.nerc.ac.uk/collection/L22/current/NETT0091/,SDN:L22::NETT0091,Marudai - Nakai (1962),"Construction comprises a 250 cm diameter mouth opening with 800 cm long net.  A series of variants designed to sample megaplankton and nekton (MDA, MDB, PMD)",1,false,2011-10-21 14:18:49.0
http://vocab.nerc.ac.uk/collection/L22/current/TOOL0661/,SDN:L22::TOOL0661,Sperry Marine MK37 series gyrocompasses,"A family of instruments that contains a controlled gyroscope which seeks and aligns itself with the meridian and points to true north. They use the properties of the gyroscope in combination with the rotation of the earth and the effect of gravity. The effects of varying speed and latitude are compensated for by the use of manually operated controls. Models MOD I, MOD O, MOD D, MOD D/E are all with an analog output Step or/and Syncro. MOD VT is the latest model with NMEA Data output as well.",2,false,2015-06-16 16:49:46.0
http://vocab.nerc.ac.uk/collection/L22/current/TOOL0687/,SDN:L22::TOOL0687,Sea-Bird SBE 56 temperature recorder,This is a small (30cm by 2.54cm diameter) high-accuracy battery-powered temperature and time logger capable of sampling intervals from 0.5 seconds to 9 hours. Battery life with a sampling rate of 15 seconds is almost two years and the memory can store over 15 million samples. Temperature is measured by a pressure-protected (1500m depth) thermistor. Initial accuracy is 0.002C and drift is typically less than 0.002C per year. More information may be found at http://www.seabird.com/products/spec_sheets/39imdata.htm.,1,false,2014-04-15 11:23:19.0
http://vocab.nerc.ac.uk/collection/L22/current/TOOL1217/,SDN:L22::TOOL1217,YSI EXO multiparameter water quality sondes,"Comprehensive multi-parameter, water-quality monitoring sondes designed for long-term monitoring, profiling and spot sampling. The EXO sondes are split into several categories: EXO1 Sonde, EXO2 Sonde, EXO3 Sonde. Each category has a slightly different design purpose with the the EXO2 and EXO3 containing more sensor ports than the EXO1. Data are collected using up to four user-replaceable sensors and an integral pressure transducer. Users communicate with the sonde via a field cable to an EXO Handheld, via Bluetooth wireless connection to a PC, or a USB connection to a PC. Typical parameter specifications for relevant sensors include dissolved oxygen with ranges of 0-50 mg/l, with a resolution of +/- 0.1 mg/l, an accuracy of 1 percent of reading for values between 0-20 mg/l and an accuracy of +/- 5 percent of reading for values 20-50 mg/l. Temp ranges are from-5 to +50 degC, with an accuracy of +/- 0.001 degC. Conductivity has a range of 0-200 mS/cm, with an accuracy of +/-0.5 percent of reading + 0.001 mS/cm and a resolution of 0.0001 - 0.01 mS/cm.",1,false,2018-03-05 16:13:15.0
http://vocab.nerc.ac.uk/collection/L22/current/TOOL0961/,SDN:L22::TOOL0961,Mini-Hamon grab,"The Mini-Hamon Grab was introduced by CEFAS and is used for obtaining samples in coarse sediment, as well as for sampling benthic infauna. The standard Hamon Grab comprises of a stainless steel box shaped sampling scoop mounted in a rectangular (but sometimes triangular) frame. It is a mini version of the standard Hamon Grab, with a typical sampling area of 0.1 m2 and a penetration depth up to 20 cm. It often has a longer than standard tooth bar fitted compared with the standard Hamon Grab.",1,false,2015-12-16 16:57:05.0
http://vocab.nerc.ac.uk/collection/L22/current/TOOL0987/,SDN:L22::TOOL0987,OCEAN sampler pup net,Plankton net described as one of typically two simple conical ring nets attached by bungee to either side of the OCEAN sampler frame to collect integrated samples; designed with single circular mouth piece with measurements: diameter (metre)=0.14; with opening area (square metre)=0.015; with total filtering net length (metre)=1.47; with filtering net shape conical; with mesh size (millimetre)=not specified; and equipped with NO closing mechanism.,1,false,2016-04-04 14:47:13.0
http://vocab.nerc.ac.uk/collection/L22/current/TOOL1156/,SDN:L22::TOOL1156,Vemco V8 Coded Transmitter Tag,"A small (8 mm diamter) acoustic transmitter used to track and determine the behavioural patterns of small and juvenile fish. The V8 tag is particularly suited for monitoring of salmon smolt migrations, and can be used to track large numbers of fish over large areas. The V8 offers an alternative between the V7 and V9 tags due to its higher output power and greater detection range. V8 coded transmitters send acoustic pings at 69 kHz that are infrequent and random about an average delay. This ping train includes an ID number which permits identification of the specific tag. The V8 can be detected by all VEMCO 69 kHz receivers. There are two battery options, the 4L or 4H. To control the characteristics of the tags, users can choose from one to four programming steps: Status (ON/OFF), time interval, acoustic power level (L/H) and nominal delay.",1,false,2017-10-16 12:08:03.0
http://vocab.nerc.ac.uk/collection/L22/current/TOOL1157/,SDN:L22::TOOL1157,Vemco V9 Coded Transmitter Tag,"A small (9 mm diamter) acoustic transmitter used to track and determine the behavioural patterns of small and juvenile fish. The V9 tag is particularly suited for monitoring of salmon smolt migrations, and can be used to track large numbers of fish over large areas. V9 coded transmitters send acoustic pings at 69 kHz that are infrequent and random about an average delay. This ping train includes an ID number which permits identification of the specific tag. The V9 tag can function as a simple pinger giving location only, or it can be equipped with depth (V9P) and temperature (V9T) sensors, or both (V9TP). The V9 can be used with the VR2W monitoring receiver, and can also be actively tracked using the VR100 acoustic tracking receiver.",2,false,2017-11-01 12:35:03.0
http://vocab.nerc.ac.uk/collection/L22/current/TOOL1154/,SDN:L22::TOOL1154,Vemco V16 Coded Transmitter Tag,"A 16 mm diamter acoustic transmitter used to track and determine the behavioural patterns of medium to large marine species. Coded transmitters send acoustic pings at 69 kHz that are infrequent and random about an average delay. This ping train includes an ID number which permits identification of the specific tag along with the sensor telemetry data. The V16 can function as a simple pinger for location only, or it can be equipped with additional sensors to include depth (V16P) and temperature (V16T) data, or both (V16TP). When used with the VR2W or VR4-UWM receiver, they can be used to track large numbers of fish over large areas. The V16 can also be manually tracked using the VR100 acoustic tracking receiver. The V16 tag will last anywhere between one month and several years depending on the chosen battery size, and will give a transmission range in excess of several hundered metres.",2,false,2017-11-01 12:30:29.0
http://vocab.nerc.ac.uk/collection/L22/current/TOOL1263/,SDN:L22::TOOL1263,Unspecified time depth recorder,"A detachable device providing detailed depth information relative to time. Often tagged to marine species to monitor their diving behaviour. The data collected by the instrument is stored in an internal memory, and can be downloaded on recovery.",1,false,2018-08-02 15:26:57.0
http://vocab.nerc.ac.uk/collection/L22/current/TOOL1152/,SDN:L22::TOOL1152,Vemco V13 Coded Transmitter Tag,"A small (13 mm diamter) acoustic transmitter used to track and determine the behavioural patterns of small and juvenile fish, for applications such as site residency studies and automated monitoring of migrations. Coded transmitters send acoustic pings at 69 kHz that are infrequent and random about an average delay. This ping train includes an ID number which permits identification of the specific tag along with the sensor telemetry data. The V13 can function as a simple pinger for location only, or it can be equipped with additional sensors to include depth (V13P) and temperature (V13T) data. When used with the VR2 and or VR3 receiver, they can be used to track large numbers of fish over large areas. The V13 can also be tracked using the VR28, the VR100, or VR60 (with Option 07 version 2.01) receivers, or the VRAP system.",1,false,2017-10-16 12:08:03.0
http://vocab.nerc.ac.uk/collection/L22/current/TOOL1158/,SDN:L22::TOOL1158,Vemco V9AP Coded Transmitter Tag,"A coded acoustic transmitter used to measure the activity of free-ranging fauna in nature, most commonly fish. The transmitter measures the 3D acceleration with depth of fauna moving within a reciever array as a vector quantity, i.e. it measures acceleration on 3 axes X, Y and Z, in metres per second squared. Other applications may include determination of swimming speed via tail beat acceleration, activity responses to changing oxygen, temperature and salinity, and detecting mortality through predation, seismic blasting, toxic spills, feeding events, spawning activity, nocturnal/diurnal activity or wave action. One of two modes of operation can be specified; an activity alogorithm or tailbeat algorithm. Coded transmitters send acoustic pings at 69 kHz that are infrequent and random about an average delay. This ping train includes an ID number which permits identification of the specific tag and sensor data. For dual sensor tags, there are two tag IDs. The V9 is also available as an accelerometer option only (V9A).",1,false,2017-10-16 12:08:03.0
http://vocab.nerc.ac.uk/collection/L22/current/TOOL0929/,SDN:L22::TOOL0929,Biotrack MK3 geolocator tags,A family of tags designed for tracking animal movements over long periods based on measurement of light levels at dawn and dusk.  The tags also measure temperature and whether they are wet or dry. Geolocator accuracy is of the order of 150km. Tags must be recovered for data download. The MK3 family weigh 2.5 grams and are designed to be attached to deep-diving and larger water birds. Tags in this family were developed by British Antarctic Survey and are produced under licence by Biotrack: the BAS MK19 as the Biotrack MK3005 and the BAS MK16 as the Biotrack MK3006.,1,false,2015-08-04 12:04:14.0
http://vocab.nerc.ac.uk/collection/L22/current/TOOL1155/,SDN:L22::TOOL1155,Vemco V7 Coded Transmitter Tag,"A small (7 mm diamter) acoustic transmitter used to track and determine the behavioural patterns of small and juvenile fish. The V7 tag is particularly suited for monitoring of salmon smolt migrations, and can be used to track large numbers of fish over large areas. V7 coded transmitters send acoustic pings at 69 kHz that are infrequent and random about an average delay. This ping train includes an ID number which permits identification of the specific tag. The V7 can be detected by all VEMCO 69 kHz receivers. There are two battery options, the 2L or 4L. To control the characteristics of the tags, users can choose from one to four programming steps: Status (ON/OFF), time interval, acoustic power level (L/H) and nominal delay.",1,false,2017-10-16 12:08:03.0
http://vocab.nerc.ac.uk/collection/L22/current/TOOL1153/,SDN:L22::TOOL1153,Vemco V13AP Coded Accelerometer Pressure Transmitter Tag,"A coded acoustic transmitter used to measure the activity of free-ranging marine fauna, most commonly fish. The transmitter measures the 3D acceleration with depth of fauna moving within a reciever array as a vector quantity, i.e. it measures acceleration on 3 axes X, Y and Z, in metres per second squared. Other applications may include determination of swimming speed via tail beat acceleration, activity responses to changing oxygen, temperature and salinity, and detecting mortality through predation, seismic blasting, toxic spills, feeding events, spawning activity, nocturnal/diurnal activity or wave action. One of two modes of operation can be specified; an activity alogorithm or tailbeat algorithm. Coded transmitters send acoustic pings at 69 kHz that are infrequent and random about an average delay. This ping train includes an ID number which permits identification of the specific tag and sensor data. For dual sensor tags, there are two tag IDs.",1,false,2017-10-16 12:08:03.0
http://vocab.nerc.ac.uk/collection/L22/current/NETT0125/,SDN:L22::NETT0125,Octagon net - Sameoto and Jaroszynski (1976),Has a 75 cm diameter iron channel octagon mouth opening which was attached to the towing wire with stainless steel snap swivels and held from sliding down by a stop on the wire. Used with a net made of 1 mm nylon mesh and towed at speeds up to 7 knots [Wiebe and Benfield 2003 Plate 3 C].,1,false,2011-10-21 14:18:49.0
http://vocab.nerc.ac.uk/collection/L22/current/TOOL1034/,SDN:L22::TOOL1034,Inverted Microscope (generic),A generic term for an inverted (the light source illuminates the specimen from above) optical microscope.,1,false,2016-11-10 12:55:24.0
http://vocab.nerc.ac.uk/collection/L22/current/TOOL1334/,SDN:L22::TOOL1334,Satlantic Hyperspectral Surface Acquisition System (HyperSAS) radiometer,"An above-water optical sensing system designed to provide continuous ocean colour measurements over the spectral range 350-800 nm. The HyperSAS can be mounted on ships and fixed platforms, or on aircrafts for remote sensing surveys. The standard configuration of the system includes one irradiance sensor to measure downwelling irradiance, and two hyperspectral radiance sensors to capture the sea surface signal. The irradiance sensor response is proportional to the cosine of the angle of incidence of the incoming radiation, while each radiance sensor has a 3 deg field of view (FOV). The orientation precision, geo-referencing and time-stamp accuracy may be improved by mounting an optional GPS unit with Satlantic tilt and heading sensor. Moreover, a radiation pyrometer may also be added to measure land or sea surface temperature.",1,false,2019-06-13 09:51:58.0
http://vocab.nerc.ac.uk/collection/L22/current/TOOL0212/,SDN:L22::TOOL0212,Aanderaa RCM 4/5 temperature and salinity recorders,Withdrawn RCM4 or RCM5 current meters fitted with conductivity and temperature sensors given a new lease of life as temperature and salinity recorders.,1,false,2010-05-18 16:10:58.0
http://vocab.nerc.ac.uk/collection/L22/current/TOOL0238/,SDN:L22::TOOL0238,Mercury reversing thermometer,A generic term for a mercury-in-glass thermometer that freezes the temperature reading when turned upside-down.,1,false,2010-05-18 16:10:58.0
http://vocab.nerc.ac.uk/collection/L22/current/TOOL0512/,SDN:L22::TOOL0512,WestCo Scientific Instruments SmartChem 200 Discrete Analyzer,A laboratory instrument designed for discrete sample analysis. A manual arm collects sample and reagents and dispenses them in a cuvette. The cuvette resides in a heated carousel wheel where the chemical reaction is allowed to proceed to the development of a colored product. The optical density of the reaction product is then measured. It may be used to measure nutrient concentrations in seawater. WestCo Scientific Instruments is a subsidiary of Unity Scientific.,1,false,2012-07-04 10:02:10.0
http://vocab.nerc.ac.uk/collection/L22/current/TOOL0538/,SDN:L22::TOOL0538,Technicap NOEX bottle,"Water bottle designed for oceanographic sampling. The bottle comprises a plastic tube with caps at each end and is deployed with the caps held open, then closed at the target depth. Multiple bottles can be deployed on a CTD frame rosette. Bottle capacity is variable, but normally several litres. The bottle was developed by Technicap in the 1990s but has been superseded by more recent models. There is no known source of support available for this sampler.",1,false,2012-09-25 16:03:31.0
http://vocab.nerc.ac.uk/collection/L22/current/TOOL0812/,SDN:L22::TOOL0812,Eppley Total Ultraviolet Radiometer,The Eppley Total Ultraviolet Radiometer (TUVR) measures total short-wave solar radiation (295 to 385 nm) with sensitivity of approx. 150 microV/Wm-2. The unit is of brass construction and includes adjustable leveling screws and a circular spirit level. The instrument utilizes a hermetically sealed selenium barrier-layer cell which is protected by a quartz window. An encapsulated narrow bandpass (interference) filter limits the spectral response of the photocell.,1,false,2014-12-09 14:23:19.0
http://vocab.nerc.ac.uk/collection/L22/current/TOOL0838/,SDN:L22::TOOL0838,Paine 3000 PSIA pressure sensor,A strain gauge pressure sensor rated to a maximum pressure of 3000 pounds per square inch absolute (2000m depth).,1,false,2015-03-26 12:14:52.0
http://vocab.nerc.ac.uk/collection/L22/current/TOOL1151/,SDN:L22::TOOL1151,ASL AZFP Acoustic Zooplankton Fish Profiler,"An autonomous scientific echosounder for the measurement and monitoring of environmental conditions in oceans, lakes and rivers. Abundance of zooplankton, fish, bubbles and suspended sediments in the water column are common targets, via the measurement of acoustic backscatter returns at multiple ultrasonic frequencies. Using onboard data storage, the AZFP can collect data continuously for periods of up to one year at high temporal and spatial resolution. The AZFP is available with up to four frequencies in a single transducer housing. It can be operated in bottom-mounted, upward looking mode or in downward looking mode from a buoy, and is ideally suited for taut-line mooring operation. It has a configurable ping rate up to 1 Hz, 16 Gb Compact Flash storage with up to 32 Gb available, and weighs 50 kg in its ruggedised shipping case.",1,false,2017-10-16 12:08:03.0
http://vocab.nerc.ac.uk/collection/L22/current/TOOL1177/,SDN:L22::TOOL1177,Unspecified box corer,"A marine geological tool that recovers undisturbed soft surface sediments. It is designed for minimum disturbance of the sediment surface by bow wave effects. Traditionally, it consists of a weighted stem fitted to a square sampling box. The corer is lowered vertically until it impacts with the seabed. At this point the instrument is triggered by a trip as the main coring stem passes through its frame. While pulling the corer out of the sediment a spade swings underneath the sample to prevent loss. When hauled back on board, the spade is under the box.",1,false,2017-11-23 13:03:21.0
http://vocab.nerc.ac.uk/collection/L22/current/TOOL0055/,SDN:L22::TOOL0055,RBR TR-1050 underwater temperature logger,"The TR-1050 is a small (230mm x 38mm OD), self-contained, submersible temperature recorder with a calibration to ±0.002°C.  Typical calibration drift of 0.002°C per year has been measured. It can be deployed for a period of up to three years and can collect more than 2,400,000 samples. Data are retained in memory for 20 years (even without batteries). It has a measurement range of -5°C to +35°C in its standard calibration but can be configured to measure wider ranges. The logger can be fitted with different thermistors to operate to as low as -40°C or up to +50°C.",2,false,2017-08-10 12:39:12.0
