Url,Identifier,PrefLabel,Definition,Version,Deprecated,Date
http://vocab.nerc.ac.uk/collection/L22/current/TOOL1295/,SDN:L22::TOOL1295,Sea-Bird SeaKeeper thermosalinograph,"A themosalinograph. It is designed for shipboard determination of sea surface pumped-water conductivity and temperature. It can measure temperature in a range from -5 deg C to +35 deg C and conductivity from 0 S/m to 7 S/m. The SeaKeeper uses the same same temperature conductivity sensors used in the SBE 21 Thermosalinograph, but has improved acquisition electronics that increase accuracy and resolution, and lower power consumption. The initial acuracy of the temperature sensor is 0.002 deg C and 0.0003 S/m for conductivity.",1,false,2018-11-19 15:04:09.0
http://vocab.nerc.ac.uk/collection/L22/current/TOOL0199/,SDN:L22::TOOL0199,Trimble NT300D Global Positioning System receiver,"A high-performance, sub-meter position GPS receiver for marine applications. It combines a state-of-the-art, 12-channel GPS receiver and a high-performance dual-channel transmitter. It was discontinued in 2009.",1,false,2010-05-18 16:10:58.0
http://vocab.nerc.ac.uk/collection/L22/current/TOOL0473/,SDN:L22::TOOL0473,Precision Measurement Engineering SCAMP microstructure profiler,"A self contained, autonomous microstructure profiler designed to measure extremely small scale (order 1 mm) fluctuations of electrical conductivity, temperature, and chlorophyll concentration in aquatic environments. It has a maximum depth rating of 100 m, a travel rate of 10 cm/s and a sampling rate of 100 Hz. The instrument is powered by internal batteries that allow it to operate continuously for at least 4 hours. The fast conductivity channel uses a PME 4-electrode conductivity microsensor while the standard conductivity channel uses a PME 4-electrode ceramic sensor. The instrument has two available fast temperature channels, each using a Thermometrics FP07 thermistor, and includes a Keller PSI PAA-10 pressure sensor. Two gradient channels are used to store d/dt computations. These data can be used to infer the levels of dissipation of turbulent kinetic energy, in-situ fluxes of heat and salt, and the microstructure behavior of these parameters. The chlorophyll fluorometer consists of a high intense blue LED and a 455 nm interface filter that illuminates a small water sample. Chlorophyll fluorescence is observed through a 685 nm interference filter by a photo diode detector. A Li-Cor LI-192SA PAR sensor can also be attached to the SCAMP. Data are stored on an internal data logger.",1,false,2012-02-21 16:06:42.0
http://vocab.nerc.ac.uk/collection/L22/current/TOOL0499/,SDN:L22::TOOL0499,Aanderaa conductivity sensor 3919B,"An inductive conductivity sensor designed to operate over a range of 0-7.5 S/m with a resolution of 0.0002 S/m and an accuracy of +/- 0.0018 S/m. The instrument includes a temperature sensor with a range of -5 to 40 degC, a resolution of 0.01 degC and an accuracy of +/-0.1 degC. The shallow water (SW) version of the instrument is rated to 300 m, the intermediate water (IW) version to 2000 m and the deep water (DW) version to 6000 m. The instrument has a titanium casing and can be interfaced with the Aanderaa RCM9/11 or RDCP, or used for standalone operations.",1,false,2012-06-13 14:30:27.0
http://vocab.nerc.ac.uk/collection/L22/current/TOOL1003/,SDN:L22::TOOL1003,Vaisala Present Weather Detector PWD series,"Vaisala Present Weather and Visibility sensors (PWD10, PWD12, PWD20 and PWD22) are compact and light-weight probes that provide accurate measurements of prevailing visibility. PWD10 and PWD12 models measure visibility in a range of 10m-2,000m while PWD20 and PWD22 are able to measure visibility up to 20,000m. Moreover,  PWD12 and PWD22 models are able to indicate the cause of prevailed visibility and detect precipitation type and rain accumulation while PWD10 and PWD20 can not measure these parameters",1,false,2016-06-20 10:24:20.0
http://vocab.nerc.ac.uk/collection/L22/current/TOOL1029/,SDN:L22::TOOL1029,Airmar Ultrasonic WeatherStation 100WX,"Airmar Ultrasonic WeatherStation 100WX is a compact meteorological station designed to provide real-time, site-specific weather information on stationary platforms. The instrument combines up to seven sensors to measure apparent wind speed and direction, barometric pressure, air temperature, relative humidity, dew point and wind chill temperature. Ultrasonic readings of apparent wind speed and direction are taken for wind speeds up to 40 m/s. Output options include NMEA 0183 (RS422) and NMEA 0183 (RS232).",1,false,2016-10-24 14:25:31.0
http://vocab.nerc.ac.uk/collection/L22/current/TOOL0799/,SDN:L22::TOOL0799,Furuno Navigator GP37 Global Positioning System receivers,"The Furuno GP-37 is a 12-parallel channel, all-in-view GPS receiver designed for coastal ships, and fishing boats. It is equipped with WAAS (Wide Area Augmentation System) and DGPS (differential GPS) receivers. It has a 4.5 inch monochrome LCD display. The unit offers position fixes with accuracy of 10m for basic GPS, 3m where a WAAS service is available, and 5m with DGPS.",1,false,2014-09-18 15:18:31.0
http://vocab.nerc.ac.uk/collection/L22/current/TOOL1303/,SDN:L22::TOOL1303,Kongsberg Maritime CONTROS HydroC CH4 (underwater) methane sensor,"A methane sensor is designed for background methane monitoring and long-term deployments. It measures in-situ CH4 partial pressure. Dissolved CH4 molecules diffuse through a thin membrane into a detector chamber where the CH4 concentration is determined by means of tunable diode laser absorption spectroscopy (TDLAS). The detector has a high accuracy in a large dynamic range of partial pressures and stability over a long time. Sensors can be adapted with a number of optional configurations such as underwater pumps, different flow head designs, antifouling heads, operational temperature ranges, battery packs and ROV, AUV, profiling and mooring frame packages etc. Measurement range: 0-40,000 uatm. Detection limit: < 1 uatm. Operating depth: 3,000 m. Accuracy: +/-2 uatm or +/-3% (whichever is greater).",1,false,2019-01-07 12:29:16.0
http://vocab.nerc.ac.uk/collection/L22/current/TOOL1329/,SDN:L22::TOOL1329,Scripps Institution of Oceanography ODF (automated) oxygen titrator,"A bench-top, oxygen titrator system designed by the Ocean Data Facility (ODF) at the Scripps Institution of Oceanography that is based on the Winkler titration method. It measures dissolved oxygen using photometric end-point detection based on the absorption of 365nm wavelength ultra-violet light. Thiosulphate is typically dispensed from a Dosimat burette. The titration and data logging are controlled by ODF PC software compiled in LabView.",2,false,2019-05-03 15:32:42.0
http://vocab.nerc.ac.uk/collection/L22/current/TOOL0507/,SDN:L22::TOOL0507,Garrett Screen surface sampler,A hand-held Monel (nickel-copper alloy) mesh screen in a rigid frame designed to sample the surface film in oceanic waters. The screen is placed horizontally through the water surface then withdrawn from the water (still held horizontally) and drained into a sample bottle. It is used to sample chemical and biological species in the surface film. The Garrett Screen was developed in the 1960s by William Garrett of the US Naval Research Laboratory.,1,false,2012-06-22 15:36:10.0
http://vocab.nerc.ac.uk/collection/L22/current/TOOL0807/,SDN:L22::TOOL0807,NIOZ Steel 10.5cm manual sediment corer,"A manual sediment corer produced by NIOZ for sampling sediments in shallow waters from a small boat.  It comprises a 10.5cm diameter (core area 0.009 m2) steel core with a closure at the top attached to a 2m aluminium pole. It is manually pushed approximately 25 cm into the sediment, the top is closed and then it is pulled out complete with the sediment sample.",3,false,2014-11-12 11:31:22.0
http://vocab.nerc.ac.uk/collection/L22/current/TOOL0590/,SDN:L22::TOOL0590,Aanderaa CTR7 thermistor conductivity chain,An instrument with up to 5 induction conductivity and thermistor temperature sensor pairs along a string held vertically in the water column and connected to a 12-channel Aanderaa DL7 data logger. The twelfth channel may be used for an optional pressure sensor housed in one of the senor pairs Overall accuracy (+/-) 0.1C for temperature and 0.3 mS/cm for conductivity.  Further information may be found in http://www.bodc.ac.uk/data/documents/nodb/78767/.,1,false,2013-01-17 10:07:40.0
http://vocab.nerc.ac.uk/collection/L22/current/TOOL1146/,SDN:L22::TOOL1146,Sequoia LISST-100X particle sizer,"A self contained unit which measures the scattering of LASER light at a number of angles. Primary measurement is mathematically inverted to provide grain size distribution and is scaled to obtain volume scattering function. The size distribution is presented as concentration in each of the grain-size class bins. Optical transmission, water depth and temperature are recorded as supporting measurements. The instrument has an optical path length of 5 cm as standard (2.5 cm optional) and measures particles over the size range 1.2 - 250 um (Type B) or 2.5-500 um (Type C) in 32 log-spaced size classes. As an option a modified endcap can be constucted to connect to a Campbell OBS-3+,Turner Cyclops-7 fluorometer or Sea-Bird Micro-Cat CTD.",1,false,2017-08-07 13:07:11.0
http://vocab.nerc.ac.uk/collection/L22/current/TOOL0890/,SDN:L22::TOOL0890,Knudsen Chirp 3260,"The Knudsen Chirp 3260 is a deep water system capable of reaching depths up to 10,000m plus. This instrument is available in a 2 or 4 channel configuration with frequencies ranging from 3.5kHz to 210kHz. The Chirp 3260 is designed for full ocean depth requirements where high power output is required",1,false,2015-06-18 14:42:56.0
http://vocab.nerc.ac.uk/collection/L22/current/TOOL0024/,SDN:L22::TOOL0024,Sea-Bird SBE 26 SEAGAUGE Wave and Tide Recorder,"The SBE 26 SEAGAUGE is a water level recorder with a Digiquartz pressure sensor, accurate clock, precision thermometer and optional conductivity sensor. Pressure data are integrated to give sea level or are burst recorded at rates up to 4 Hz to measure characterise waves. Further information may be found on the BODC document server at URL http://www.bodc.ac.uk/data/documents/nodb/82441/.",1,false,2009-11-30 11:27:51.0
http://vocab.nerc.ac.uk/collection/L22/current/TOOL1420/,SDN:L22::TOOL1420,ASL Environmental Sciences Zooplankton Acoustic Profiler (ZAP) 200 kHz {Water Column Profiler (WCP)} echosounder,"A cable tethered instrument designed to measure and record the Water Column moving through its field of view from the seabed during long, unattended, deployments. It transmits an acoustic pulse of programmable duration, then listens for the echo from targets in the water column. It returns a value of the acoustic intensity for every 12.5 cm. It can be deployed up to 150 m beneath the surface, looking upward, or from the surface looking downward.",1,false,2020-04-17 09:50:17.0
http://vocab.nerc.ac.uk/collection/L22/current/NETT0054/,SDN:L22::NETT0054,Hensen egg net - Hensen (1887); Jenkins (1901); Wimpenny (1937),"Construction is a 38 cm diameter mouth (40 cm long conical mouth piece); 100 cm diameter conical net mouth. 144 cm long net of No. 20 silk [Wiebe and Benfield 2003 Plate 1 A, B)",1,false,2011-10-21 14:18:49.0
http://vocab.nerc.ac.uk/collection/L22/current/TOOL0924/,SDN:L22::TOOL0924,Vector Instruments cup anemometer,"Instrument used to measure wind speed. The model is unknown. It is assumed to consist of a 3-cup rotor, a precision ball-race mounted shaft and internal modules and components to provide electrical output signals.  The outline and mechanical design of Vector Instruments cup anemometers, common to the A100 series, has remained largely unchanged since the introduction of the original Porton Anemometer in 1972.",1,false,2015-07-30 14:44:53.0
http://vocab.nerc.ac.uk/collection/L22/current/TOOL1387/,SDN:L22::TOOL1387,Sparton of Canada T-10 XBT probe,"An expendable free-fall temperature probe that provides a profile of measured temperature against depth calculated from a fall-rate model. The T-10 XBT Probe can be used within a maximum depth of 200m, may be deployed at a ship speed of up to 10 knots and has a vertical resolution of 65cm.",1,false,2020-01-15 10:59:20.0
http://vocab.nerc.ac.uk/collection/L22/current/TOOL1382/,SDN:L22::TOOL1382,Sparton of Canada T-3 XBT probe,An expendable free-fall temperature probe that provides a profile of measured temperature against depth calculated from a fall-rate model. The T-3 XBT Probe can be used to a maximum depth of 760m.,2,false,2020-01-15 11:52:02.0
http://vocab.nerc.ac.uk/collection/L22/current/TOOL1389/,SDN:L22::TOOL1389,Lockheed Martin Sippican AXBT XBT probe,An expendable free-fall temperature probe that provides a profile of measured temperature against depth calculated from a fall-rate model. The AXBT Probe is deployed by aircraft and can be used to a maximum depth of 800 m.,1,false,2020-01-15 10:59:20.0
http://vocab.nerc.ac.uk/collection/L22/current/TOOL1290/,SDN:L22::TOOL1290,Lockheed Martin Sippican Fast Deep XBT probe,"An expendable free-fall temperature probe that provides a profile of measured temperature against depth calculated from a fall-rate model. The Fast Deep Probe can be used within a maximum depth of 1000m, may be deployed at a ship speed of up to 20 knots and has a vertical resolution of 65cm.",1,false,2018-10-24 13:57:27.0
http://vocab.nerc.ac.uk/collection/L22/current/TOOL1388/,SDN:L22::TOOL1388,Sparton of Canada T-20 XBT probe,"An expendable free-fall temperature probe that provides a profile of measured temperature against depth calculated from a fall-rate model. The T-20 XBT Probe can be used within a maximum depth of 460m, may be deployed at a ship speed of up to 20 knots and has a vertical resolution of 65cm.",1,false,2020-01-15 10:59:20.0
http://vocab.nerc.ac.uk/collection/L22/current/TOOL1381/,SDN:L22::TOOL1381,Sparton of Canada T-1 XBT probe,An expendable free-fall temperature probe that provides a profile of measured temperature against depth calculated from a fall-rate model. The T-1 XBT Probe can be used to a maximum depth of 460m.,2,false,2020-01-15 11:51:29.0
http://vocab.nerc.ac.uk/collection/L22/current/TOOL1384/,SDN:L22::TOOL1384,Sparton of Canada T-5 XBT probe,"An expendable free-fall temperature probe that provides a profile of measured temperature against depth calculated from a fall-rate model. The T-5 XBT Probe can be used within a maximum depth of 1830m, may be deployed at a ship speed of up to 6 knots and has a vertical resolution of 65cm.",1,false,2020-01-15 10:59:20.0
http://vocab.nerc.ac.uk/collection/L22/current/TOOL0713/,SDN:L22::TOOL0713,Sparton AXBT,An expendable free-fall temperature probe that provides a profile of measured temperature against depth calculated from a fall-rate model. The AXBT Probe is deployed by aircraft and can be used to a maximum depth of 800m.,1,false,2014-07-08 16:17:50.0
http://vocab.nerc.ac.uk/collection/L22/current/TOOL0262/,SDN:L22::TOOL0262,Lockheed Martin Sippican T-5 XBT probe,"An expendable free-fall temperature probe that provides a profile of measured temperature against depth calculated from a fall-rate model. The T-5 XBT Probe can be used within a maximum depth of 1830m, may be deployed at a ship speed of up to 6 knots and has a vertical resolution of 65cm.",1,false,2010-05-18 16:10:58.0
http://vocab.nerc.ac.uk/collection/L22/current/TOOL0263/,SDN:L22::TOOL0263,Lockheed Martin Sippican T-7 XBT probe,"An expendable free-fall temperature probe that provides a profile of measured temperature against depth calculated from a fall-rate model. The T-7 XBT Probe can be used within a maximum depth of 760m, may be deployed at a ship speed of up to 15 knots and has a vertical resolution of 65cm.",1,false,2010-05-18 16:10:58.0
http://vocab.nerc.ac.uk/collection/L22/current/TOOL0435/,SDN:L22::TOOL0435,Lockheed Martin Sippican T-4 XBT probe,"An expendable free-fall temperature probe that provides a profile of measured temperature against depth calculated from a fall-rate model. The T-4 XBT Probe can be used within a maximum depth of 460m, may be deployed at a ship speed of up to 30 knots and has a vertical resolution of 65cm.",1,false,2011-11-02 11:37:25.0
http://vocab.nerc.ac.uk/collection/L22/current/TOOL1383/,SDN:L22::TOOL1383,Sparton of Canada T-4 XBT probe,"An expendable free-fall temperature probe that provides a profile of measured temperature against depth calculated from a fall-rate model. The T-4 XBT Probe can be used within a maximum depth of 460m, may be deployed at a ship speed of up to 30 knots and has a vertical resolution of 65cm.",1,false,2020-01-15 10:59:20.0
http://vocab.nerc.ac.uk/collection/L22/current/TOOL0716/,SDN:L22::TOOL0716,Lockheed Martin Sippican T-11 XBT probe,"An expendable free-fall temperature probe that provides a profile of measured temperature against depth calculated from a fall-rate model. The T-11 XBT Probe can be used to a maximum depth of 460m, may be deployed at a ship speed of up to 6 knots and has a vertical resolution of  65cm.",1,false,2014-07-08 16:24:25.0
http://vocab.nerc.ac.uk/collection/L22/current/TOOL0718/,SDN:L22::TOOL0718,Lockheed Martin Sippican T-10 XBT probe,"An expendable free-fall temperature probe that provides a profile of measured temperature against depth calculated from a fall-rate model. The T-10 XBT Probe can be used to a maximum depth of 200m, may be deployed at a ship speed of up to 10 knots and has a vertical resolution of 65cm.",1,false,2014-07-08 16:28:56.0
http://vocab.nerc.ac.uk/collection/L22/current/TOOL0717/,SDN:L22::TOOL0717,Lockheed Martin Sippican T-6 XBT probe,"An expendable free-fall temperature probe that provides a profile of measured temperature against depth calculated from a fall-rate model. The T-6 XBT Probe can be used to a maximum depth of 460m, may be deployed at a ship speed of up to 15 knots and has a vertical resolution of 65cm.",1,false,2014-07-08 16:27:38.0
http://vocab.nerc.ac.uk/collection/L22/current/TOOL1287/,SDN:L22::TOOL1287,Unspecified {MBT} mechanical bathythermograph,"A term to describe a generic mechanical bathythermograph (MBT). A small torpedo-shaped device that records water temperature in relation to depth. MBTs traditionally use a liquid-in-metal thermometer (toluene and copper tube) to measure temperature and Bourdon tube sensor to measure pressure. Temperature readings are recorded by a mechanical stylus, which scratches a thin line on a coated glass slide. Depth is then calculated as a function of pressure. MBTs are lowered into the water by a winch and dropped free-falling to a specified depth before being retrieved. It is capable of measuring temperature to depths of 300 m.",1,false,2018-10-05 10:40:30.0
http://vocab.nerc.ac.uk/collection/L22/current/TOOL1291/,SDN:L22::TOOL1291,Unspecified (XBT) expendable bathythermograph,"A term to describe a generic expendable bathythermograph (XBT), a disposable, free-fall temperature probe that provides a profile of measured temperature against depth calculated from a fall-rate model.",1,false,2018-10-24 15:21:23.0
http://vocab.nerc.ac.uk/collection/L22/current/TOOL0715/,SDN:L22::TOOL0715,Lockheed Martin Sippican Deep Blue XBT probe,"An expendable free-fall temperature probe that provides a profile of measured temperature against depth calculated from a fall-rate model. The Deep Blue XBT Probe (sometimes referred to as the T-7DB) can be used to a maximum depth of 460m, may be deployed at a ship speed of up to 20 knots and has a vertical resolution of 65cm.",2,false,2015-06-11 08:41:00.0
http://vocab.nerc.ac.uk/collection/L22/current/TOOL1385/,SDN:L22::TOOL1385,Sparton of Canada T-6 XBT probe,"An expendable free-fall temperature probe that provides a profile of measured temperature against depth calculated from a fall-rate model. The T-6 XBT Probe can be used within a maximum depth of 460m, may be deployed at a ship speed of up to 15 knots and has a vertical resolution of 65cm.",1,false,2020-01-15 10:59:20.0
http://vocab.nerc.ac.uk/collection/L22/current/TOOL1386/,SDN:L22::TOOL1386,Sparton of Canada T-7 XBT probe,"An expendable free-fall temperature probe that provides a profile of measured temperature against depth calculated from a fall-rate model. The T-7 XBT Probe can be used within a maximum depth of 760m, may be deployed at a ship speed of up to 15 knots and has a vertical resolution of 65cm.",1,false,2020-01-15 10:59:20.0
http://vocab.nerc.ac.uk/collection/L22/current/TOOL1273/,SDN:L22::TOOL1273,LaCoste and Romberg S83 gravity meter modified by Zero Length Spring corporation,"A gravity meter modified by the Zero Length Spring (ZLS) corporation for shipborne and aircraft use, designed to measure the gravitational field.",1,false,2018-08-02 15:26:57.0
http://vocab.nerc.ac.uk/collection/L22/current/TOOL0863/,SDN:L22::TOOL0863,Varian V75 Magnetometer,The Varian V75 magnetometer was a sealed towed proton precession magnetometer that takes measurements of the earth's magnetic field. No further information available.,1,false,2015-05-27 15:47:59.0
http://vocab.nerc.ac.uk/collection/L22/current/TOOL0876/,SDN:L22::TOOL0876,LaCoste and Romberg S33 gravity meter,A stabilized-platform sensor which measures the Earth's gravitational field. It is used for operations in the air and at sea. The system comprises a gravity meter mounted on a gyro-stabilized platform. The system consists of fixed aluminium air-dampers and a 96 TPI (threads per inch) measuring screw. The accuracy of sensor is about 2mGal.,1,false,2015-06-08 15:32:54.0
http://vocab.nerc.ac.uk/collection/L22/current/TOOL0752/,SDN:L22::TOOL0752,Micro-g LaCoste air-sea gravity system II gravimeter,"Device used for gravity measurements from ships and aircarft. The system incoporates Zero-Length String sensor technology, fibre optic gyros and accelorometers. System resolution; 0.01 milliGals. Accuracy at sea; < 1.00 mGal (reported). The system replaced the S-Meter.",1,false,2014-07-18 10:41:59.0
http://vocab.nerc.ac.uk/collection/L22/current/TOOL0865/,SDN:L22::TOOL0865,LaCoste and Romberg S84 Gravity Meter,"A marine gravity meter that measures the earth's gravitational field. The S84 consists of a highly overdamped, spring type gravity sensor mounted on a gyro-stabilised patform. Range: 12000 milligals, static accuracy: 0.01 milligal.",1,false,2015-05-27 15:47:59.0
http://vocab.nerc.ac.uk/collection/L22/current/TOOL1289/,SDN:L22::TOOL1289,Partrac Voyager II Benthic Annular Flume,"A benthic flume designed for in-situ studies of sediment mobilisation and transport, based on the designs and dimensions of Amos et al. (1992b). It primarily measures transport parameters such as the critical erosion threshold. It consists of an aluminium channel 0.3 m high and 0.15 m wide, with a total diameter of 2.2 m. Eight equidistantly spaced paddles induce a current via drive train, driven by a 0.6 hp, 24 V DC submarine motor and gearbox. This casues water to be re-circulated over, and oscillatory stress to be imposed upon, exposed bottom sediments. On-board optical backscatter sensors (Seapoint OBS) measure turbidity to determine suspended particulate matter concentrations at 3 different heights. An on-board Nortek Vectrino Velocimeter measures velocity in the along-channel (u), across-channel (v) and vertical (w) directions 0.15 m above the nominal bed level. An on-board 12 × 50 ml syringe sampling system collects water samples of the flume waters and a submarine video records vertical photographic profiles of the erosion processes in the upper 0.05 m. Sediment cores can also be collected concurrent with deployment. The Voyager II is depth-rated to 200 m and can impose maximum shear stresses up to ~3 Pa on bottom sediments.",1,false,2018-10-15 15:10:34.0
http://vocab.nerc.ac.uk/collection/L22/current/TOOL0141/,SDN:L22::TOOL0141,HOBI HydroScat-2 Optical Backscatter Fluorometer,"Instrument that measures optical backscatter at 2 wavelengths (420nm and 700nm as standard but can be customised) plus chlorophyll fluorescence. Casings available for 330m, 4000m or custom maximum depth working.",1,false,2010-05-18 16:10:58.0
http://vocab.nerc.ac.uk/collection/L22/current/TOOLZZZ/,SDN:L22::TOOLZZZ,unknown,"The correct value is not known to, and not computable by, the creator of this information. However, a correct value probably exists.",1,false,2009-11-26 12:14:36.0
http://vocab.nerc.ac.uk/collection/L22/current/TOOL0441/,SDN:L22::TOOL0441,Sequoia Laser In-Situ Sediment Size Transmissometer model 100-B,"A self-contained unit which measures the scattering of LASER light at a number of angles. This primary measurement is mathematically inverted to give a grain size distribution, and also scaled to obtain the volume scattering function. The size distribution is presented as concentration in each of the grain-size class bins. The instrument has an optical path length of 5cm as standard (2.5cm optional) and measures particles over the size range 1.2 - 250um in 32 log-spaced size classes. The standard maximum sampling speed is 4 size distributions per second and the instrument has a depth rating of 300m. Optical transmission, water depth and temperature are recorded as supporting measurements.",1,false,2011-11-16 08:14:57.0
http://vocab.nerc.ac.uk/collection/L22/current/TOOL0467/,SDN:L22::TOOL0467,Hitachi High-Technologies U-2000 UV-Visible spectrophotometer,A laboratory instrument that measures the amount of light at discrete pre-determined wavelengths that is transmitted or emitted by a sample. This is a double beam instrument that operates over the spectral range 190-1100 nm with a 2 nm bandpass and an accuracy of 0.4 nm. The instrument uses a concave diffraction grating monochromator and a silicon photodiode detector. This model is no longer in production.,1,false,2012-02-21 16:06:42.0
