Url,Identifier,PrefLabel,Definition,Version,Deprecated,Date
http://vocab.nerc.ac.uk/collection/L22/current/TOOL0244/,SDN:L22::TOOL0244,Alpkem RFA/2 colorimetric autoanalyser,"A rapid flow analyser that may be used to measure nutrient concentrations in seawater. It is a continuous flow instrument consisting of a sampler, peristaltic pump, analytical cartridge, heating bath, colorimeter, data station, and printer.",2,false,2010-11-18 12:39:41.0
http://vocab.nerc.ac.uk/collection/L22/current/TOOL0415/,SDN:L22::TOOL0415,Astoria Pacific micro-segmented flow analyser,"A continuous flow analyser that can be used to measure nutrient concentrations in seawater. The six channel digital detector allows analysis of four to six parameters from a single sample. The system consists of a sampler, a peristaltic pump, reaction cartridge, colorimeter and data acquisition software. The pump pushes a sample into the reaction cartridge, where the sample and reagent are brought together. Air-segmentation bubbles are introduced to help facilitate the mixing of sample and reagents. The sample is then analysed colorimetrically. This instrument is an upgrade of the Alpkem RFA-300, which was bought from OI Analytical by Astoria Pacific Inc.",1,false,2011-08-05 09:08:32.0
http://vocab.nerc.ac.uk/collection/L22/current/TOOL0342/,SDN:L22::TOOL0342,ChemLab AA-II segmented continuous flow autoanalyser,"A rapid flow analyser that may be used to measure nutrient concentrations in seawater. It is a continuous flow instrument consisting of a sampler, peristaltic pump, analytical cartridge, heating bath, colorimeter, data station, and printer.",1,false,2010-09-06 12:45:22.0
http://vocab.nerc.ac.uk/collection/L22/current/TOOL0414/,SDN:L22::TOOL0414,Alpkem RFA-300 colorimetric autoanalyser,"A rapid flow analyser (RFA) that may be used to measure nutrient concentrations in seawater. It is an air-segmented, continuous flow instrument comprising a sampler, a peristaltic pump which simultaneously pumps samples, reagents and air bubbles through the system, analytical cartridge, heating bath, colorimeter, data station, and printer. The RFA-300 was a precursor to the smaller Alpkem RFA/2 (also RFA II or RFA-2).",1,false,2011-08-05 09:08:32.0
http://vocab.nerc.ac.uk/collection/L22/current/TOOL0614/,SDN:L22::TOOL0614,Burkard Scientific SFA 2000 colorimetric AA-II segmented flow analyser,A colorimetric segmented flow nutrient AA-II analyser. The standard high sensitivity colorimetric and UV detectors use filter technology and flow through cells with a range of path lengths from 3-50mm.,1,false,2013-04-23 11:31:40.0
http://vocab.nerc.ac.uk/collection/L22/current/TOOL1271/,SDN:L22::TOOL1271,Kongsberg Simrad PAL OE1364 colour CCD camera,"A colour inspection charge-couple device (CCD) camera built into an underwater housing, designed for diver and vehicle deployment to 1500m depth. The OE1364 camera comprises a 8.0mm (1/2"") Hole-Accumulation Diode (HAD) sensor and a 625 Line/50Hz Phase Alternating Line (PAL) video encoding system. The horizontal resolution is 460 Television lines (TVL), and the light sensitivity is 0.1 lux. The automatic iris control optical feature includes a manual over-ride for low-lighting conditions.",1,false,2018-08-02 15:26:57.0
http://vocab.nerc.ac.uk/collection/L22/current/TOOL1005/,SDN:L22::TOOL1005,Vaisala Present Weather Detector PWD12,"Vaisala Present Weather and Visibility sensor PWD12 is a compact and light-weight probes that provide accurate measurements of prevailing visibility. This sensor is able to measure visibility between 10m and 2,000m and is able to indicate the cause of prevailed visibility and detect precipitation type and rain accumulation",1,false,2016-06-20 10:24:20.0
http://vocab.nerc.ac.uk/collection/L22/current/TOOL0775/,SDN:L22::TOOL0775,TriOS RAMSES-ACC-VIS Hyperspectral UV-VIS Radiometer,"This is a spectral radiometer measuring over the visual and UV bands (320-950 nm) with a cosine-response to measure irradiance. It is fitted with a 256-channel silicon photodiode array with 190 usable channels giving 3.3 nm per pixel and a spectral accuracy of 0.3 nm. Typical saturation (4 ms integration time) is 10 W m-2 nm-1 (at 400nm), 8 W m-2 nm-1 (at 500nm) and 14 W m-2 nm-1 (at 700nm). Typical NEI (8 sec integration time) is 0.4 µW m-2 nm-1 (at 400nm), 0.4 µW m-2 nm-1 (at 500nm) and 0.6 µW m-2 nm-1 (at 700nm). Accuracy is quoted as better than 6-10 per cent (depending on spectral range). The accompanying software is capable of providing PAR and UV integrations and converting the energy measurements into photon fluxes. More information is available at http://www.trios.de/.",1,false,2014-08-18 12:53:59.0
http://vocab.nerc.ac.uk/collection/L22/current/TOOL1305/,SDN:L22::TOOL1305,Biospherical Instruments QSP-2150 underwater PAR sensor,"Quantum Scalar Irradiance PAR Sensor. Developed for multi-parameter logging applications. It uses a scalar irradiance collector to obtain a uniform directional response over 3.6-pi steradians. A stainless steel encased optical light pipe guides flux from the collector to a filtered silicon photodetector, resulting in a flat quantum response over the PAR spectral region (400-700 nm). The sensor produces a digital ASCII output and uses a Teledyne-Impulse MCBH series connector. It uses a 24?bit analog to digital converter (ADC) operating at frequencies of 4 to up to 250 Hz. It has a stability (dark reading) of < 0.003 microE m-2 sec?1 and operates in waters depths up to 2000 m.",1,false,2019-01-30 12:22:02.0
http://vocab.nerc.ac.uk/collection/L22/current/TOOL0509/,SDN:L22::TOOL0509,Lasentec Partec 100 focused beam reflectance measurement particle sizer,"An in situ particle sizer that uses the principal of focused beam reflectance measurement (FBRM) to measure particle sizes in the range 2-1000 um in a liquid. The probe tip includes an optic filter, beam splitter, laser beam and sapphire window, through which laser light is passed into the liquid. The light is diffracted by particles suspended in the liquid and the FBRM measures the chord length distribution (CLD), which is a function of the number, size and shape of the particles. Typically, many thousands of chords are measured per second, providing a robust measurement sensitive to the change in the size or number of particles. The instrument can be deployed on a hydrographic wire and lowered to the required depth, where is is held steady while a particle spectrum is collected. The instrument was developed by Lasentec (also known as Lasentech), which has since been taken over by Mettler Toledo. The Partec 100 is no longer in production.",1,false,2012-06-22 15:36:10.0
http://vocab.nerc.ac.uk/collection/L22/current/TOOL0809/,SDN:L22::TOOL0809,RBR TGR-2050 submersible tide gauge,"A small (265mm x 38mm OD) self-contained, submersible temperature and pressure logger designed to monitor tide levels without interference from wave action by averaging pressure data sampled at 4 Hz. This operating mode differentiates it from the similar TDR-2050. Temperature channel is calibrated to ±0.002C. Depth channel is calibrated to an accuracy of ±0.05% full scale.",2,false,2014-11-19 14:11:16.0
http://vocab.nerc.ac.uk/collection/L22/current/TOOL1122/,SDN:L22::TOOL1122,Sea-Bird SBE 39plus temperature sensor,"A water body temperature sensor. It is designed for moorings or other long-duration, fixed-site deployments, as well as deployments on nets, towed vehicles, or ROVs. It uses an aged and pressure-protected thermistor that is available in two configurations: embedded in titanium endcap (25-sec time constant) for rugged conditions, or external thermistor in pressure-protected sheath (0.5-sec time constant) for fast sampling. It can be fitted with an optional strain-gauge pressure sensor with temperature compensation available in eight ranges (maximum depth 7000 m). Sensor housing is either PET plastic or titanium. The temperature sensor has a measurement range of -5 to +45 deg C, an accuracy of +/- 0.002 (-5 to +35 deg C) or +/- 0.01 (+35 to +45 deg C) and a depth rating of 600 m (plastic) or 10,500 m (titanium).",1,false,2017-04-04 10:06:11.0
http://vocab.nerc.ac.uk/collection/L22/current/TOOL1148/,SDN:L22::TOOL1148,"TitraLab TIM90, ABU91/ABU93 automated titration system","A modular, automated titration system for the laboratory. This includes a TIM90 titration manager, which can manage up to 3 burettes and store 40 methods; and either an ABU 91 Autoburette (one burette), or an ABU 93 Triburette (three burettes), both with 1 ml, 5 ml, 10 ml and 25 ml selectable quantities.",1,false,2017-09-01 16:28:19.0
http://vocab.nerc.ac.uk/collection/L22/current/TOOL0892/,SDN:L22::TOOL0892,Knudsen 320BR echosounder,The Knudsen 320 B/R operates at different frequencies (12kHz and 3.5kHz). The 12kHz allows for water depth record and the 3.5kHz to track pingers attached to various instruments over the side. This is also used for sub-bottom profiling applications.,1,false,2015-06-18 14:42:56.0
http://vocab.nerc.ac.uk/collection/L22/current/TOOL0026/,SDN:L22::TOOL0026,Aanderaa RCM 11 Recording Current Meter,The RCM 11 is a single-point doppler recording current meter pressure cased to operate at depths of up to 6000 metres. Further information may be found on the BODC document server at URL http://www.bodc.ac.uk/data/documents/nodb/106028/,1,false,2010-09-07 11:22:02.0
http://vocab.nerc.ac.uk/collection/L22/current/TOOL0600/,SDN:L22::TOOL0600,Proudman Oceanographic Laboratory 1MHz ADCP,"An ADCP with a range of 30 m, designed to measure currents in up to 24 bins. Data from bins in the shallowest 15 percent of the depth range (ie: closest to the transducer) and in the deepest 10 percent (furthest from the transducer) are unreliable due to interference. The instrument uses two orthogonal beams and a built-in compass to resolve northward and eastward components of current.",1,false,2013-02-07 15:46:44.0
http://vocab.nerc.ac.uk/collection/L22/current/TOOL0626/,SDN:L22::TOOL0626,Aanderaa conductivity sensor 4319A,"An inductive conductivity sensor designed to operate over a range of 0-7.5 S/m with a resolution of 0.0002 S/m and an accuracy of +/- 0.005 S/m. The instrument includes a temperature sensor with a range of -5 to 40 degC, a resolution of 0.01 degC and an accuracy of +/-0.1 degC. The shallow water (SW) version of the instrument is rated to 300 m, the intermediate water (IW) version to 2000 m and the deep water (DW) version to 6000 m. The instrument has a titanium casing and can be interfaced with the Aanderaa RCM9/11 or RDCP, or used for standalone operations. Unlike the Aanderaa 3919A, the 4319A incorporates SmartGuard data logger connectivity, and updated AADI protocol.",1,false,2013-06-12 15:42:34.0
http://vocab.nerc.ac.uk/collection/L22/current/TOOL0900/,SDN:L22::TOOL0900,Teledyne TSS Orion inertial navigation system,"An Inertial Navigation System (INS) used for hydrographic survey, offshore construction and ROV operations. The system comprises three Ring Laser Gyros (RLG) and three accelerometers. A surface and sub-sea variant is available. Heading accuracy: 0.1 degrees RMS secant latitude (with GPS antenna aiding). Pitch and roll dynamic accuracy: 0.01 degrees. Heave accuracy: 5cm or 5% whichever is greater.",1,false,2015-06-19 09:20:24.0
http://vocab.nerc.ac.uk/collection/L22/current/TOOL0231/,SDN:L22::TOOL0231,Gemini Tinytag plus TGP-0050 temperature recorder,A data logger plus a 10k NTC thermistor internally mounted within a robust IP68 waterproof casing suitable for measuring atmospheric or shallow water temperatures. Temperatures in the range -30 to 50C can be measured and the logger may be used up to water depths of 15 metres. The instrument can store approximately 16000 data readings and be set up with measurement intervals between one second and ten days.,1,false,2010-05-18 16:10:58.0
http://vocab.nerc.ac.uk/collection/L22/current/TOOL0620/,SDN:L22::TOOL0620,Steedman Science and Engineering CM01 Acoustic Current Meter,A recording current meter fitted with two orthogonal acoustic transducers and a flux-gate compass. The water velocity is measured using an acoustic phase shift technique and the resulting current vectors are averaged over a user-specified interval. Further information may be found in http://www.bodc.ac.uk/data/documents/nodb/148626/.,1,false,2013-05-09 16:22:25.0
http://vocab.nerc.ac.uk/collection/L22/current/TOOL0105/,SDN:L22::TOOL0105,Vemco Minilog12 temperature recorder,A miniature data logger that records temperature at a user programmed time interval. 12-bit version gives a resolution of 0.015C and an accuracy of +-0.1C. It is housed in a waterproof cylinder and the temperature sensor is mounted on a protruding stainless steel probe. Further information may be found on the BODC document server at URL: http://www.bodc.ac.uk/data/documents/nodb/108661/,2,false,2014-02-14 10:13:29.0
http://vocab.nerc.ac.uk/collection/L22/current/TOOL1162/,SDN:L22::TOOL1162,Sea-Bird SBE 25plus Sealogger CTD,"A compact and self-contained battery-powered CTD for use in coastal, estuarine and deep-water deployments to measure temperature and conductivity with depth. The whole unit is mounted in a stainless steel cage with battery pack, data logger and internal memory. The 25plus comprises an SBE 3F temperature sensor, SBE 4C conductivity sensor, and a strain-gauge pressure sensor. It utilises pump-controlled T-C ducted flow to minimise salinity spiking. The instrument may also be used with external power and data logging through an RS-232 interface, and offers channels for up to ten auxiliary sensors such as oxygen, pH, fluorescence, PAR, turbidity, light transmission and nitrates. The 25plus samples at 16 Hz and is suitable for use in water depths ranging from 600-6800 m. The SBE 25plus replaces the SBE 25 which was discontinued in 2012.",1,false,2017-10-16 12:08:03.0
http://vocab.nerc.ac.uk/collection/L22/current/TOOL0043/,SDN:L22::TOOL0043,Chelsea Technologies Group Aqualog CTD,"A self-contained unit comprising pressure, temperature and conductivity sensors, an optional dissolved oxygen sensor, a fluorometer and a data logger. The unit could be used in a variety of modes including vertical profiling, towed undulator and short-term moorings.",2,false,2010-11-18 12:39:41.0
http://vocab.nerc.ac.uk/collection/L22/current/TOOL1188/,SDN:L22::TOOL1188,Sea-Bird CT Sail CTD,"A self-contained unpumped unit comprising the temperature, conductivity and pressure sensors that is designed specifically for deployment on ocean gliders. The sensors are typically installed externally on the hull of the glider. These are OEM products with variable specifications; they are calibrated in a calibration fixture at Sea-Bird, removed from that fixture, and installed in a housing that Sea-Bird does not know or have control over. Additionally, sensor performance is dependent on flow rate through the cell and water column temperature and salinity gradients.",1,false,2017-12-12 14:44:05.0
http://vocab.nerc.ac.uk/collection/L22/current/TOOL1207/,SDN:L22::TOOL1207,Aanderaa Pressure Sensor 4117/4117R,"An integrated pressure and temperature sensor designed to either be connected to an Aanderaa SmartGuard data logger, to be mounted on to the Aanderaa SeaGuard platform, or to operate as a stand-alone sensor using RS-232. The instrument can operate down to 6000 m depth, and has a selectable interval of 1 second to 255 minutes. The pressure range varies between the six sensor models, from 0-1000 kPa for the 4117A/4117AR model, to 0-60000 kPa for the 4117F/4117FR model; for all models, the pressure resolution is <0.0001 % full scale output (FSO) and the pressure accuracy is +/- 0.2% FSO. All models have a temperature range of 0 degC to 36 degC, a resolution of <0.001 degC, and an accuracy of 0.05 degC.",1,false,2018-01-30 16:59:47.0
http://vocab.nerc.ac.uk/collection/L22/current/TOOL0731/,SDN:L22::TOOL0731,ReefNet Sensus Ultra,"The ReefNet Sensus Ultra is a compact temperature and depth logging sensor designed for use as a dive computer. Depths between 0 and 500 feet are measured with precision better than 0.5 inches of water, and accuracy of +/-12 inches. Temperature is measured between -20 degC and + 40 degC, with precision of 0.01 degC, and accuracy of +/-0.8 degC. Sampling interval is configurable from 1 second to over 18 hours, with storage capacity of one year at 60 second sampling resolution.",1,false,2014-07-09 16:23:06.0
http://vocab.nerc.ac.uk/collection/L22/current/TOOL1412/,SDN:L22::TOOL1412,Nortek Aquadopp IM6000 (inductive modem) 3D Doppler current meter,"The Nortek Aquadopp 6000 is a single-depth doppler current meter designed for deployment on deep water moorings, although it is also suitable for attachment to fixed structures. It features higher power and an increased signal-to-noise ratio compared with the standard (300 m depth rated) Aquadopp so that it can provide accurate current measurements in water with low concentrations of suspended particulate matter. Current velocity is derived from the Doppler shift measured by two or three 2MHz acoustic beams. It comes with compass, tilt, pressure and temperature sensors. It can be run in 'diagnostic' mode when set to collect data at 1 Hz frequency in user specified intervals, which allows studies of mooring motion and the performance of other current meters to be conducted. The IM6000 is an optional addition to the Aquadopp 6000 3D doppler current meter, featuring an Inductive Modem Module (IMM). The IMM enables communication over a jacketed (isolated) mooring line, where data can be stored in ASCII or binary format. The IMM is located next to the Aquadopp electronics inside the pressure housing of the instrument. The instrument has a titanium casing rated to 6000 m. Water velocity measurements are accurate to +/- 1 percent of the measured value, +/- 0.5 cm/s, with a transducer acoustic frequency of 2 MHz.",1,false,2020-03-25 16:41:09.0
http://vocab.nerc.ac.uk/collection/L22/current/TOOL0707/,SDN:L22::TOOL0707,Analog Devices AD590 Temperature Transducer,"This is a 2-terminal integrated circuit temperature transducer that produces an output current proportional to absolute temperature (one microAmp per Kelvin). It is calibrated by laser trimming of the resistors on the chip to produce an output of 298.2 microAmps at 298.2K. It is supplied in a range of standard electronic component packages for inclusion on circuit boards. It can operate from -55-150C, is linear to 0.3C over full range and has an accuracy of 0.5C. Further details may be found at http://www.analog.com/en/mems-sensors/digital-temperature-sensors/ad590/products/product.html.",1,false,2014-06-17 10:17:19.0
http://vocab.nerc.ac.uk/collection/L22/current/TOOL0675/,SDN:L22::TOOL0675,WETLabs Water Quality Monitor,"An instrument that incorporates WET Labs' fluorometer-turbidity and Sea-Bird's CTD sensors, providing temperature, salinity, depth, dissolved oxygen, chlorophyll fluorescence, turbidity and backscattering data. It is designed for long-term deployment in coastal waters with protection against biofouling and fouling by sediment loads. More information is available at http://www.wetlabs.com/wqm.",1,false,2014-03-13 12:29:26.0
http://vocab.nerc.ac.uk/collection/L22/current/TOOL1318/,SDN:L22::TOOL1318,AML Oceanographic X Metrec multiparameter CTD,"An interchangeable, in-situ multiparameter CTD sonde. It is designed for ROV or long-term remote deployments. The instrument features an interchangeable sensor head that allows users to change the sensor load from a dedicated pool of AML Xchange sensor caps. Available sensors measure combinations of conductivity, temperature, sound velocity, turbidity and pressure. The instrument also features auxiliary sensor ports. Supported communication protocols are RS-232 or RS-485. The instrument can be equipped with optional biofouling controls (UV or copper-nickel alloy cage). Sampling rates are set by time (2 Hz to every 24 hours), by pressure (0.1 dbar or greater increments), or by sound speed (0.1 m/s or greater increments). It is depth-rated to 500 m or 6000 m.",1,false,2019-02-20 10:56:32.0
http://vocab.nerc.ac.uk/collection/L22/current/TOOL0888/,SDN:L22::TOOL0888,Nortek Aquadopp Doppler current profiler,"A family of self-contained Doppler current profilers designed for deployment on the seabed, moorings, buoys or fixed structures.  A range of transducers - 400 kHz (60-90m range: 2-8m cell size), 600 kHz (30-40m range: 1-4m cell size), Z-cell 600 kHz, 1 MHz (12-20m range: 0.3-4m cell size), Z-cell 1MHz, 2 MHz (4-10m range:0.1-2m cell size) and side-looking.  Each transducer has 3 beams and the instrument has a maximum of 128 cells. Current speeds up to 10 m/s may be measured at an accuracy of 1% of measured value ±0.5cm/s. The standard depth rating is 300 m with 3000 m or 600m versions available. Temperature (embedded thermistor with 0.1C accuracy and 0.01C resolution), compass (magnetometer with 2 degrees accuracy and 0.1 degree resolution providing tilt <20 degrees), tilt (liquid level with 0.2 degree accuracy and 0.1 degree resolution) and pressure (piezo resistive with accuracy of 0.5% full scale - usually 100m - and resolution of 0.005% full scale) sensors are provided as standard.",1,false,2015-06-18 13:59:38.0
http://vocab.nerc.ac.uk/collection/L22/current/TOOL0228/,SDN:L22::TOOL0228,Hugrun Seamon Mini temperature recorder,A small underwater temperature sensor and data logger manufactured by Hugrun (subsequently Star-Oddi) and no longer manufactured under that name.,1,false,2010-05-18 16:10:58.0
http://vocab.nerc.ac.uk/collection/L22/current/TOOL0266/,SDN:L22::TOOL0266,Sea-Bird SBE 39 temperature recorder,"A high-accuracy temperature recorder (pressure optional) with internal battery and non-volatile memory for deployment at depths up to 10500 meters. It is intended for moorings or other long-term, fixed-site applications, as well as shorter-term deployments on nets, towed vehicles or ROVs. Calibration coefficients stored in EEPROM allow the SBE 39 to transmit data in engineering units. The SBE 39 thermistor has a long history of exceptional accuracy and stability (typical drift is less than 0.002C per year). The SBE 39 communicates directly with a computer via a standard RA-232 interface. For more information see http://www.bodc.ac.uk/data/documents/nodb/108627/",1,false,2010-05-18 16:10:58.0
http://vocab.nerc.ac.uk/collection/L22/current/NETT0029/,SDN:L22::NETT0029,Discrete-depth plankton sampler - Aron et al. (1964),A cod-end sampler used with IKMT or a 1-m diameter net with underwater electronics to sample depth and temperature operated with single conductor cable. Mark III had 10 or 15 cm diameter opening and four catch chambers [Wiebe and Benfield 2003 Plate 26 B].,1,false,2011-10-21 14:18:49.0
http://vocab.nerc.ac.uk/collection/L22/current/TOOL1286/,SDN:L22::TOOL1286,Nortek Vector 3D Acoustic Velocimeter,"An acoustic current meter designed to measure high-resolution water velocity and pressure data in marine environments. It is used for studies of turbulence, waves, bottom boundary layers, ocean engineering, coasts and rivers. The Vector 3D outputs Doppler velocity, temperature, pressure, tilt, and heading measurements, and uses the principle of Doppler shift to measure current velocity. It supports real-time or burst sampling methods to preserve battery power. An optional motion sensor (Attitude and Heading Reference System, AHRS) with a faster response time can be used in place of the standard magentometer, heading and tilt sensors. The AHRS is useful for studying the motion of the Vector itself, allowing improved separation of Vector motion from velocity measurements. The Vector 3D measures veolcity over the range +/- 0.01 to 7 m/s with an accuracy +/- 0.5 % of measured value +/- 1 mm/s. It measures temperature over the range -4 to +40 degC with an accuracy of 0.1 degC and resolution of 0.01 degC. It has a sampling rate of 1 to 64 Hz, a battery capacity of 100 Wh and is depth-rated to 300 m.",1,false,2018-09-27 16:12:19.0
http://vocab.nerc.ac.uk/collection/L22/current/TOOL0022/,SDN:L22::TOOL0022,Sea-Bird SBE 37-IM MicroCAT C-T Sensor,The SBE 37 MicroCAT is a high accuracy conductivity and temperature recorder with an optional pressure sensor designed for deployment on moorings. The IM model has an inductive modem for real-time data transmission plus internal flash memory data storage. Further information may be found on the BODC document server at URL http://www.bodc.ac.uk/data/documents/nodb/113079/.,3,false,2017-04-03 11:45:41.0
http://vocab.nerc.ac.uk/collection/L22/current/TOOL1163/,SDN:L22::TOOL1163,Teledyne RDI Citadel CTD-NH,"A fast-sampling, fully integrated CTD package for use in environmental monitoring, fisheries, ocean observing networks and other marine applications. It measures condutivity and temperature with depth and utilises the patented Non-eXternal Inductive Cell (NXIC) conductivity sensor. The CTD-NH exhibits a bio-fouling resistant design, and the NXIC internal conductivity cells do not suffer from proximity effects, allowing it to be mounted in any orientation close to other instruments. The CTD-NH offers optional datalogging and external analog sensor input, and can run for 400 hours on its internal 3V battery pack. It is depth rated to 500 m.",1,false,2017-10-16 15:31:15.0
